<?xml version="1.0" encoding="UTF-8" standalone="no" ?>
<?xml-stylesheet type="text/xsl" href="livre.xsl"?>
<livre xmlns:xsi="http://www.w3.org/2001/XMLSchema-instance"
    xsi:noNamespaceSchemaLocation="livre.xsd">
    <!-- livre1 -->
    
    <auteur>
        <nom>Paulo </nom>
        <prenom>Coelho</prenom>
        <nationalité>brésilien</nationalité>
    </auteur>
    <titre>Adultère</titre>
    <description>Roman</description>
    <cover>livre1.jpg</cover>
    <date>2014</date>
    
   
    <section>
        <titre_s>Résumé</titre_s>
        <paragraphe> Dans Adultère, Paulo Coelho raconte le destin d’une femme mariée, Linda, journaliste mère de famille comblée. Or, cette petite vie bien rangée l’ennuie. Ce n’est que, lorsqu’au hasard d’une interview, elle retrouve un ancien flirt de jeunesse devenu politicien, qu’elle renouera avec la passion.
            
            Elle se plaint, "vois ce que je deviens !" Serre-moi bien, dans nôtre pays serein. C'est l'histoire de l'arrogance d'une femme, l'histoire de ses aventures, ses découvertes, de ses errances sexuelles; de ses désordres; quand le temps l'a enrichie, protégée, sécurisée dans son statut, ses affections, sa situation.
            
            C'est le récit de ses surenchères, sexuelles, caractérielles, consuméristes. Elle est journaliste, il est haut placé... L'autre aussi, qui lui fera découvrir sa face sombre, ses désirs mimétiques non souhaités, ses actions éloignées de ses vrais désirs. Elle retrouvera un autre équilibre après avoir évolué et bien profité des circonstances, bien à l'abri de sa prudence et de son plaisir primaire, malgré ses déconvenues. Et ce dans le cocon protecteur de l'opulence et de la distraction ; pour vivre son spleen, ses fantasmes, son épanouissement aussi... pense-t-elle.
        </paragraphe>
        <paragraphe> 
            Sed ut perspiciatis unde omnis iste natus error sit voluptatem accusantium doloremque laudantium, totam rem aperiam, eaque ipsa quae ab illo inventore veritatis et quasi architecto beatae vitae dicta sunt explicabo. Nemo enim ipsam voluptatem quia voluptas sit aspernatur aut odit aut fugit, sed quia consequuntur magni dolores eos qui ratione voluptatem sequi nesciunt. Neque porro quisquam est, qui dolorem ipsum quia dolor sit amet, consectetur, adipisci velit, sed quia non numquam eius modi tempora incidunt ut labore et dolore magnam aliquam quaerat voluptatem. Ut enim ad minima veniam, quis nostrum exercitationem ullam corporis suscipit laboriosam, nisi ut aliquid ex ea commodi consequatur? Quis autem vel eum iure reprehenderit qui in ea voluptate velit esse quam nihil molestiae consequatur, vel illum qui dolorem eum fugiat quo voluptas nulla pariatur
            At vero eos et accusamus et iusto odio dignissimos ducimus qui blanditiis praesentium voluptatum deleniti atque corrupti quos dolores et quas molestias excepturi sint occaecati cupiditate non provident, similique sunt in culpa qui officia deserunt mollitia animi, id est laborum et dolorum fuga. Et harum quidem rerum facilis est et expedita distinctio. Nam libero tempore, cum soluta nobis est eligendi optio cumque nihil impedit quo minus id quod maxime placeat facere possimus, omnis voluptas assumenda est, omnis dolor repellendus. Temporibus autem quibusdam et aut officiis debitis aut rerum necessitatibus saepe eveniet ut et voluptates repudiandae sint et molestiae non recusandae. Itaque earum rerum hic tenetur a sapiente delectus, ut aut reiciendis voluptatibus maiores alias consequatur aut perferendis doloribus asperiores repellat.
            dolor sit amet, consectetur adipisicing elit, sed do eiusmod tempor incididunt ut labore et dolore magna aliqua. Ut enim ad minim veniam, quis nostrud exercitation ullamco laboris nisi ut aliquip ex ea commodo consequat. Duis aute irure dolor in reprehenderit in voluptate velit esse cillum dolore eu fugiat nulla pariatur. Excepteur sint occaecat cupidatat non proident, sunt in culpa qui officia deserunt mollit anim id est laborum.
        </paragraphe>
    </section>
</livre>