<?xml version="1.0" encoding="UTF-8" standalone="no" ?>
<?xml-stylesheet type="text/xsl" href="livre.xsl"?>
<livre xmlns:xsi="http://www.w3.org/2001/XMLSchema-instance"
    xsi:noNamespaceSchemaLocation="livre.xsd">
    <!-- livre8 -->
    
    <auteur>
        <nom>Honoré de</nom>
        <prenom>Balzac</prenom>
        <nationalité>Français</nationalité>
    </auteur>
    <titre>Le Père Goriot</titre>
    <description>Roman</description>
    <cover>livre8.jpg</cover>
    <date>1842</date>
    
    <section>
        <titre_s>Résumé</titre_s>
        <paragraphe>
            Le roman s'ouvre en 1819, avec la description sordide et répugnante de la maison Vauquer, une pension parisienne située dans la rue Neuve-Sainte-Geneviève, appartenant à la veuve Vauquer. Plusieurs résidents s'y côtoient, dont Eugène de Rastignac, jeune étudiant en droit, un mystérieux personnage un peu rustre et grossier nommé Vautrin et un ancien vermicellier (fabricant de pâtes et de pain) ayant fait fortune pendant la Révolution, maintenant retraité, complètement désargenté et veuf, surnommé le père Goriot par la veuve Vauquer, frustrée dans ses intentions de mariage avec lui à l'époque où il était arrivé à la pension, riche, bien mis et en possession de beaucoup de mobilier. La plupart des pensionnaires se sont mis à l'appeler ainsi aussi, le tournant en ridicule et le considérant comme sénile et diminué. Logent également dans la pension d'autres personnes, comme Melle Michonneau, Victorine Taillefer, ou encore Horace Bianchon.
        </paragraphe>
        <paragraphe> 
            test  test test test test test test test test test test test test test test test test test test test test test test test test test test test test test test test test test test test test test test test test test test test test test test test test test test test test test test test test test test test test test test test test test test test test test test test test test test test test test test test test test test test test test test test test test test test test test test test test test test test test test test test test test test test test test test test test test test test test test test test test test test test test test test test test test test test test test test test test test test test test test test test test test test test test test test test test test test test test test test test test test test test test test test test test test test test test test test test test test test test test test test test test test test test test test test test test test test test test test test test test test test test test test test test test test test test test test test test test test test test test test test test test test test test test test test test test test test test test test test test test test test test test test test test test test test test test test test test test test test test test test test test test test test test test test test test test test test test test test test test test test test test test test test test test test test test test test test test test test test test test test test test test test test test test test test test test test test test test test test test test test test test test test test test test test test test test test test test test test test test test test test test test test test test test test test test test test test test test test test test test test test test test test test test test test test test test test test test test test test test test test test test test test test test test test test test test test test test test test test test test test test test test test test test test test test test test test test test test test test test test test test test test test test test test test test test test test test test test test test test test test test test test test test test test test test test test test test test test test test test test test test test test test test test test test test test test test test test test test test test test test test test test test test test test test test test test test test test test test test test test test test test test test test test test test test test test test test test test test test test test test test test test test test test test test test test test test test test test test test test test test test test test test test test test test test test test test test test test test test test test test test test test test test test test test test test test test test test test test test test test test test test test test test test test test test test test test test test test test test test test test test test test test test test test test test test test test test test test test test test test test test test test test test test test test test test test test test test test test test test test test test test test test test test test test test test test test test test test test test test test test test test test test test test test test test test test test test test test test test test test test test test test test test test test test test test test test test test test test test test test test test test test test test test test test test test test test test test test test test test test test test test test test test test test test test test test test test test test test test test test test test test test test test test test test test test test test test test test test test test test test test test test test test test test test test test test test test test test test test test test test test test test test test test test test test test test test test test test test test test test test test test test test test test test test test test test test test test test test test test test test test test test test test test test test test test test test test test test test test test test test test test test test test test test test test test test test test test test test test test test test test test test test test test test test test test test test test test test test test test test test test test test test test test test test test test test test test test test test test test test test test test test test test test test test test test test test test test test test test test test test test test test test test test test test test test test test test test test test test test test test test test test test test test test test test test test test test test test test
        </paragraphe>
        
    </section>
</livre>

