<?xml version="1.0" encoding="UTF-8" standalone="no" ?>
<?xml-stylesheet type="text/xsl" href="livre.xsl"?>
<livre xmlns:xsi="http://www.w3.org/2001/XMLSchema-instance"
    xsi:noNamespaceSchemaLocation="livre.xsd">
    <!-- livre4 -->
    
    <auteur>
        <nom>George</nom>
        <prenom> Martin</prenom>
        <nationalité>américain</nationalité>
    </auteur>
    <titre>Le Trône de fer </titre>
    <description>Roman</description>
    <cover>livre4.jpg</cover>
    <date>1996</date>
    
    <section>
        <titre_s>Résumé</titre_s>
        <paragraphe>L'histoire se situe à une époque médiévale, sur un continent appelé Westeros au sein du royaume des Sept Couronnes. Ce royaume est dirigé par Robert Baratheon depuis qu'il a chassé du trône le roi fou, Aerys Targaryen.
            
            Au début de l'histoire, le roi voyage vers le nord de son royaume pour proposer le poste de Main du Roi (sorte de premier ministre) à son grand ami Eddard Stark, le seigneur de Winterfell. Celui-ci accepte et se rend à Port-Réal, la capitale du royaume pour exercer son pouvoir. Il tente de déjouer les complots, tandis que sur un autre continent, de l'autre côté du Détroit, Daenerys Targaryen, la fille du roi déchu, rêve de reconquérir le trône de son père, le Trône de fer.</paragraphe>
        
        <paragraphe> 
            test  test test test test test test test test test test test test test test test test test test test test test test test test test test test test test test test test test test test test test test test test test test test test test test test test test test test test test test test test test test test test test test test test test test test test test test test test test test test test test test test test test test test test test test test test test test test test test test test test test test test test test test test test test test test test test test test test test test test test test test test test test test test test test test test test test test test test test test test test test test test test test test test test test test test test test test test test test test test test test test test test test test test test test test test test test test test test test test test test test test test test test test test test test test test test test test test test test test test test test test test test test test test test test test test test test test test test test test test test test test test test test test test test test test test test test test test test test test test test test test test test test test test test test test test test test test test test test test test test test test test test test test test test test test test test test test test test test test test test test test test test test test test test test test test test test test test test test test test test test test test test test test test test test test test test test test test test test test test test test test test test test test test test test test test test test test test test test test test test test test test test test test test test test test test test test test test test test test test test test test test test test test test test test test test test test test test test test test test test test test test test test test test test test test test test test test test test test test test test test test test test test test test test test test test test test test test test test test test test test test test test test test test test test test test test test test test test test test test test test test test test test test test test test test test test test test test test test test test test test test test test test test test test test test test test test test test test test test test test test test test test test test test test test test test test test test test test test test test test test test test test test test test test test test test test test test test test test test test test test test test test test test test test test test test test test test test test test test test test test test test test test test test test test test test test test test test test test test test test test test test test test test test test test test test test test test test test test test test test test test test test test test test test test test test test test test test test test test test test test test test test test test test test test test test test test test test test test test test test test test test test test test test test test test test test test test test test test test test test test test test test test test test test test test test test test test test test test test test test test test test test test test test test test test test test test test test test test test test test test test test test test test test test test test test test test test test test test test test test test test test test test test test test test test test test test test test test test test test test test test test test test test test test test test test test test test test test test test test test test test test test test test test test test test test test test test test test test test test test test test test test test test test test test test test test test test test test test test test test test test test test test test test test test test test test test test test test test test test test test test test test test test test test test test test test test test test test test test test test test test test test test test test test test test test test test test test test test test test test test test test test test test test test test test test test test test test test test test test test test test test test test test test test test test test test test test test test test test test test test test test test test test test test test test test test test test test test test test test test test test test test test test test test test test test test test test test test test test test test test test test test test test test test test test test test test test test test test test test test test test test test test test test test test test test test test test test test test test test test test
        </paragraphe>
    </section>
</livre>

