<?xml version="1.0" encoding="UTF-8" standalone="no" ?>
<?xml-stylesheet type="text/xsl" href="livre.xsl"?>
<livre xmlns:xsi="http://www.w3.org/2001/XMLSchema-instance"
    xsi:noNamespaceSchemaLocation="livre.xsd">
    <!-- livre5 -->
    
    <auteur>
        <nom>Amélie</nom>
        <prenom>Nothomb</prenom>
        <nationalité>Belge</nationalité>
    </auteur>
    <titre>Soif</titre>
    <description>Roman</description>
    <cover>livre5.jpg</cover>
    <date>2019</date>
    
    <section>
        <titre_s>Résumé</titre_s>
        <paragraphe>
            La romancière se glisse dans la tête de Jésus-Christ depuis son procès jusqu'à la résurrection, et raconte à la première personne les réflexions du Christ sur son Père, le corps, l'amour, la jouissance, l'ingratitude humaine, la souffrance, l'espérance, la foi ou encore la mort. Le temps de la Passion ravive la mémoire d’événements, d’expériences, de rencontres présentes dans le Nouveau Testament sous l'oeil de Jésus, qui raconte « son » Judas, ou encore le « best of » de ses miracles2.
            
            A propos de l'écriture du roman, elle explique que : « Tous les livres que j’ai écrits avant celui-ci étaient des exercices de musculation destinés à m’entraîner à écrire ce livre. Il y avait préméditation, je savais que je voulais écrire mon livre sur Jésus, que c’était ce qui m’importait. Si je n’ai cessé de repousser l’échéance, c’est que je ne me sentais pas assez musclée, je n’étais pas encore l’athlète de l’écriture que je rêvais d’être. »
        </paragraphe>
        <paragraphe> 
            test  test test test test test test test test test test test test test test test test test test test test test test test test test test test test test test test test test test test test test test test test test test test test test test test test test test test test test test test test test test test test test test test test test test test test test test test test test test test test test test test test test test test test test test test test test test test test test test test test test test test test test test test test test test test test test test test test test test test test test test test test test test test test test test test test test test test test test test test test test test test test test test test test test test test test test test test test test test test test test test test test test test test test test test test test test test test test test test test test test test test test test test test test test test test test test test test test test test test test test test test test test test test test test test test test test test test test test test test test test test test test test test test test test test test test test test test test test test test test test test test test test test test test test test test test test test test test test test test test test test test test test test test test test test test test test test test test test test test test test test test test test test test test test test test test test test test test test test test test test test test test test test test test test test test test test test test test test test test test test test test test test test test test test test test test test test test test test test test test test test test test test test test test test test test test test test test test test test test test test test test test test test test test test test test test test test test test test test test test test test test test test test test test test test test test test test test test test test test test test test test test test test test test test test test test test test test test test test test test test test test test test test test test test test test test test test test test test test test test test test test test test test test test test test test test test test test test test test test test test test test test test test test test test test test test test test test test test test test test test test test test test test test test test test test test test test test test test test test test test test test test test test test test test test test test test test test test test test test test test test test test test test test test test test test test test test test test test test test test test test test test test test test test test test test test test test test test test test test test test test test test test test test test test test test test test test test test test test test test test test test test test test test test test test test test test test test test test test test test test test test test test test test test test test test test test test test test test test test test test test test test test test test test test test test test test test test test test test test test test test test test test test test test test test test test test test test test test test test test test test test test test test test test test test test test test test test test test test test test test test test test test test test test test test test test test test test test test test test test test test test test test test test test test test test test test test test test test test test test test test test test test test test test test test test test test test test test test test test test test test test test test test test test test test test test test test test test test test test test test test test test test test test test test test test test test test test test test test test test test test test test test test test test test test test test test test test test test test test test test test test test test test test test test test test test test test test test test test test test test test test test test test test test test test test test test test test test test test test test test test test test test test test test test test test test test test test test test test test test test test test test test test test test test test test test test test test test test test test test test test test test test test test test test test test test test test test test test test test test test test test test test test test test test test test test test test test test test test test test test test test test test test test test test test test test test test test test test test test test test test test test test test test test test test test test test test test test test test test test test
        </paragraphe>
        
    </section>
</livre>

