<?xml version="1.0" encoding="UTF-8" standalone="no" ?>
<?xml-stylesheet type="text/xsl" href="livre.xsl"?>
<livre xmlns:xsi="http://www.w3.org/2001/XMLSchema-instance"
    xsi:noNamespaceSchemaLocation="livre.xsd">
    <!-- livre7 -->
    
    <auteur>
        <nom>Chinua</nom>
        <prenom>Achebe</prenom>
        <nationalité>Nigérian</nationalité>
    </auteur>
    <titre>Tout s'effondre</titre>
    <description>Roman</description>
    <cover>livre7.jpg</cover>
    <date>1958</date>
    
    <section>
        <titre_s>Résumé</titre_s>
        <paragraphe>
            Le protagoniste du roman, Okonkwo, est célèbre dans les villages d'Umuofia pour ses talents de lutteur, battant un lutteur surnommé Amalinze le chat (parce qu'il ne tombe jamais sur le dos). Okonkwo est fort, travailleur et s'efforce de ne montrer aucune faiblesse. Il veut faire oublier le souvenir de son père Unoka, de ses dettes impayées, de sa négligence envers sa femme et ses enfants, et de sa lâcheté à la vue du sang. Okonkwo travaille à bâtir sa richesse entièrement seul, car Unoka est mort d'une mort honteuse et ne lui a laissé que de nombreuses dettes. Il est aussi obsédé par sa masculinité, et tout petit compromis à ce sujet est rapidement renié. Par conséquent, il bat souvent ses femmes et ses enfants, et il est méchant avec ses voisins. Sa volonté d'échapper à l'héritage de son père le conduit à être riche, courageux et puissant parmi les gens de son village. C'est un leader de son village. Il a atteint une position dans sa société pour laquelle il s'est battu toute sa vie
        </paragraphe>
        <paragraphe> 
            test  test test test test test test test test test test test test test test test test test test test test test test test test test test test test test test test test test test test test test test test test test test test test test test test test test test test test test test test test test test test test test test test test test test test test test test test test test test test test test test test test test test test test test test test test test test test test test test test test test test test test test test test test test test test test test test test test test test test test test test test test test test test test test test test test test test test test test test test test test test test test test test test test test test test test test test test test test test test test test test test test test test test test test test test test test test test test test test test test test test test test test test test test test test test test test test test test test test test test test test test test test test test test test test test test test test test test test test test test test test test test test test test test test test test test test test test test test test test test test test test test test test test test test test test test test test test test test test test test test test test test test test test test test test test test test test test test test test test test test test test test test test test test test test test test test test test test test test test test test test test test test test test test test test test test test test test test test test test test test test test test test test test test test test test test test test test test test test test test test test test test test test test test test test test test test test test test test test test test test test test test test test test test test test test test test test test test test test test test test test test test test test test test test test test test test test test test test test test test test test test test test test test test test test test test test test test test test test test test test test test test test test test test test test test test test test test test test test test test test test test test test test test test test test test test test test test test test test test test test test test test test test test test test test test test test test test test test test test test test test test test test test test test test test test test test test test test test test test test test test test test test test test test test test test test test test test test test test test test test test test test test test test test test test test test test test test test test test test test test test test test test test test test test test test test test test test test test test test test test test test test test test test test test test test test test test test test test test test test test test test test test test test test test test test test test test test test test test test test test test test test test test test test test test test test test test test test test test test test test test test test test test test test test test test test test test test test test test test test test test test test test test test test test test test test test test test test test test test test test test test test test test test test test test test test test test test test test test test test test test test test test test test test test test test test test test test test test test test test test test test test test test test test test test test test test test test test test test test test test test test test test test test test test test test test test test test test test test test test test test test test test test test test test test test test test test test test test test test test test test test test test test test test test test test test test test test test test test test test test test test test test test test test test test test test test test test test test test test test test test test test test test test test test test test test test test test test test test test test test test test test test test test test test test test test test test test test test test test test test test test test test test test test test test test test test test test test test test test test test test test test test test test test test test test test test test test test test test test test test test test test test test test test test test test test test test test test test test test test test test test test test test test test test test test test test test test test test test test test test test test test test test test test test test test test test test test test test test test test test test test test test test test test test test test test test test test test test test test test test
        </paragraphe>
        
    </section>
</livre>

