<?xml version="1.0" encoding="UTF-8" standalone="no" ?>
<?xml-stylesheet type="text/xsl" href="livre.xsl"?>
<livre xmlns:xsi="http://www.w3.org/2001/XMLSchema-instance"
    xsi:noNamespaceSchemaLocation="livre.xsd">
    <!-- livre9 -->
    
    <auteur>
        <nom>Henrik Johan</nom>
        <prenom>Ibsen</prenom>
        <nationalité>Norvégien</nationalité>
    </auteur>
    <titre>Une maison de poupée</titre>
    <description>Roman</description>
    <cover>livre9.jpg</cover>
    <date>1879</date>
    
    <section>
        <titre_s>Résumé</titre_s>
        <paragraphe>
            Nora, personnage principal de la pièce, est mariée depuis huit ans au banquier Torvald Helmer, avec lequel elle a eu trois enfants. Son mari la traite comme une mineure, ne cessant de l'appeler son "alouette" ou son "petit écureuil" et de lui dicter ce qu'elle doit faire, considérant que c'est le rapport normal entre un homme et sa femme, comme le veut l'idéologie de l'époque.
            
            L'intrigue se greffe sur un événement qui s'est produit peu après leur mariage : le médecin de famille a annoncé à Nora que son mari était atteint d'une grave maladie et que le seul moyen de le sauver était de l'emmener se reposer en Italie, d'où il est effectivement revenu guéri. Mais le voyage coûtant cher et Nora n'en ayant pas les moyens, elle n'a trouvé d'autre recours que d'emprunter l'argent à Krogstad, un collègue de son mari, à l'insu de ce dernier et de faire un faux en écriture, sans avoir conscience de la gravité de son acte.
            
            Krogstad envoie une lettre expliquant tout à Helmer. Ce dernier réagit avec horreur, dégoût et colère. Il ne pense qu'à sa réputation, et qualifie l'amour qui a poussé Nora à agir comme elle l'a fait de "prétexte stupide".
            
            Peu après, une seconde lettre parvient à Helmer, contenant la reconnaissance de dette de sa femme : Krogstad renonce à rendre l'affaire publique. À la suite de quoi Helmer pardonne à sa femme. Mais la pièce ne s'arrête pas là : Nora quitte son mari pour mieux comprendre le monde et trouver ses propres réponses aux grandes questions de la vie. Dans l'optique d'un possible retour, elle impose une condition à son mari : "que leur vie en commun puisse devenir un mariage".
        </paragraphe>
        <paragraphe> 
            test  test test test test test test test test test test test test test test test test test test test test test test test test test test test test test test test test test test test test test test test test test test test test test test test test test test test test test test test test test test test test test test test test test test test test test test test test test test test test test test test test test test test test test test test test test test test test test test test test test test test test test test test test test test test test test test test test test test test test test test test test test test test test test test test test test test test test test test test test test test test test test test test test test test test test test test test test test test test test test test test test test test test test test test test test test test test test test test test test test test test test test test test test test test test test test test test test test test test test test test test test test test test test test test test test test test test test test test test test test test test test test test test test test test test test test test test test test test test test test test test test test test test test test test test test test test test test test test test test test test test test test test test test test test test test test test test test test test test test test test test test test test test test test test test test test test test test test test test test test test test test test test test test test test test test test test test test test test test test test test test test test test test test test test test test test test test test test test test test test test test test test test test test test test test test test test test test test test test test test test test test test test test test test test test test test test test test test test test test test test test test test test test test test test test test test test test test test test test test test test test test test test test test test test test test test test test test test test test test test test test test test test test test test test test test test test test test test test test test test test test test test test test test test test test test test test test test test test test test test test test test test test test test test test test test test test test test test test test test test test test test test test test test test test test test test test test test test test test test test test test test test test test test test test test test test test test test test test test test test test test test test test test test test test test test test test test test test test test test test test test test test test test test test test test test test test test test test test test test test test test test test test test test test test test test test test test test test test test test test test test test test test test test test test test test test test test test test test test test test test test test test test test test test test test test test test test test test test test test test test test test test test test test test test test test test test test test test test test test test test test test test test test test test test test test test test test test test test test test test test test test test test test test test test test test test test test test test test test test test test test test test test test test test test test test test test test test test test test test test test test test test test test test test test test test test test test test test test test test test test test test test test test test test test test test test test test test test test test test test test test test test test test test test test test test test test test test test test test test test test test test test test test test test test test test test test test test test test test test test test test test test test test test test test test test test test test test test test test test test test test test test test test test test test test test test test test test test test test test test test test test test test test test test test test test test test test test test test test test test test test test test test test test test test test test test test test test test test test test test test test test test test test test test test test test test test test test test test test test test test test test test test test test test test test test test test test test test test test test test test test test test test test test test test test test test test test test test test test test test test test test test test test test test test test test test test test test test test test test test test test test test test test test test test test test test test test test test test test test test
        </paragraphe>
        
    </section>
</livre>

